[
  {
    "name": "Display name for PacBio.DataSet.HdfSubreadSet",
    "updatedAt": "2015-11-12T23:37:21.411",
    "description": "Description for PacBio.DataSet.HdfSubreadSet",
    "id": "PacBio.DataSet.HdfSubreadSet",
    "createdAt": "2015-11-12T23:37:21.411",
    "shortName": "hdfsubreads"
  },
  {
    "name": "Display name for PacBio.DataSet.ConsensusAlignmentSet",
    "updatedAt": "2015-11-12T23:37:21.411",
    "description": "Description for PacBio.DataSet.ConsensusAlignmentSet",
    "id": "PacBio.DataSet.ConsensusAlignmentSet",
    "createdAt": "2015-11-12T23:37:21.411",
    "shortName": "ccsalignments"
  },
  {
    "name": "Display name for PacBio.DataSet.ConsensusReadSet",
    "updatedAt": "2015-11-12T23:37:21.411",
    "description": "Description for PacBio.DataSet.ConsensusReadSet",
    "id": "PacBio.DataSet.ConsensusReadSet",
    "createdAt": "2015-11-12T23:37:21.411",
    "shortName": "ccsreads"
  },
  {
    "name": "Display name for PacBio.DataSet.ReferenceSet",
    "updatedAt": "2015-11-12T23:37:21.411",
    "description": "Description for PacBio.DataSet.ReferenceSet",
    "id": "PacBio.DataSet.ReferenceSet",
    "createdAt": "2015-11-12T23:37:21.411",
    "shortName": "references"
  },
  {
    "name": "Display name for PacBio.DataSet.SubreadSet",
    "updatedAt": "2015-11-12T23:37:21.411",
    "description": "Description for PacBio.DataSet.SubreadSet",
    "id": "PacBio.DataSet.SubreadSet",
    "createdAt": "2015-11-12T23:37:21.411",
    "shortName": "subreads"
  },
  {
    "name": "Display name for PacBio.DataSet.AlignmentSet",
    "updatedAt": "2015-11-12T23:37:21.411",
    "description": "Description for PacBio.DataSet.AlignmentSet",
    "id": "PacBio.DataSet.AlignmentSet",
    "createdAt": "2015-11-12T23:37:21.411",
    "shortName": "alignments"
  },
  {
    "name": "Display name for PacBio.DataSet.BarcodeSet",
    "updatedAt": "2015-11-12T23:37:21.411",
    "description": "Description for PacBio.DataSet.BarcodeSet",
    "id": "PacBio.DataSet.BarcodeSet",
    "createdAt": "2015-11-12T23:37:21.411",
    "shortName": "barcodes"
  },
  {
    "name": "Display name for PacBio.DataSet.ContigSet",
    "updatedAt": "2015-11-12T23:37:21.411",
    "description": "Description for PacBio.DataSet.ContigSet",
    "id": "PacBio.DataSet.ContigSet",
    "createdAt": "2015-11-12T23:37:21.410",
    "shortName": "contigs"
  }
]